{
  "slug": "inicio",
  "documentTitle": "NuageHub - Portal de Onboarding",
  "navLabel": "Página Inicial",
  "hero": {
    "variant": "home",
    "badge": {
      "icon": "award",
      "text": "Boas-vindas ao time!"
    },
    "title": [[{ "text": "Sua jornada de sucesso" }], [{ "text": "começa aqui e agora.", "emphasis": true }]],
    "description": [
      {
        "text": "Portal central de integração da equipe. Siga o roteiro de primeiros passos, acesse as plataformas do dia a dia e consulte o playbook tático para acelerar seus resultados."
      }
    ],
    "actions": [
      {
        "label": "Começar pelos Primeiros Passos",
        "to": "/primeiros-passos",
        "icon": "arrow-right",
        "style": "primary"
      },
      { "label": "Abrir Playbook SDR", "to": "/playbook", "style": "secondary" }
    ]
  },
  "blocks": [
    {
      "type": "cards",
      "cards": [
        {
          "icon": "compass",
          "accent": "blue",
          "tag": "Início rápido",
          "title": "Primeiros Passos",
          "subtitle": "Roteiro dos primeiros 30 dias",
          "description": [
            { "text": "Checklist guiado com rotinas de integração, alinhamento cultural e expectativas de evolução." }
          ],
          "action": { "label": "Acessar conteúdo", "to": "/primeiros-passos", "icon": "chevron-right", "style": "card" }
        },
        {
          "icon": "layers",
          "accent": "purple",
          "tag": "Guia técnico",
          "title": "Plataformas",
          "subtitle": "Stack de produtividade & gestão",
          "description": [
            { "text": "Tutoriais passo a passo, permissões e práticas recomendadas no ClickUp, CRM e canais internos." }
          ],
          "action": { "label": "Acessar conteúdo", "to": "/plataformas", "icon": "chevron-right", "style": "card" }
        },
        {
          "icon": "book-open",
          "accent": "teal",
          "tag": "Comercial",
          "title": "Playbook",
          "subtitle": "Táticas de prospecção para SDRs",
          "description": [
            {
              "text": "Cadências de outbound, scripts para cold calls, quebra de objeções e metodologias de qualificação."
            }
          ],
          "action": { "label": "Acessar conteúdo", "to": "/playbook", "icon": "chevron-right", "style": "card" }
        }
      ]
    },
    {
      "type": "checklist",
      "label": "Cronograma",
      "title": "Checklist Inicial",
      "meta": { "icon": "clock", "text": "Meta: 1ª Semana" },
      "items": [
        {
          "id": "setup",
          "day": "Dia 1",
          "title": "Boas-vindas & Setup Essencial",
          "description": "Configuração de e-mail corporativo, acesso ao ClickUp e canais oficiais.",
          "defaultDone": true
        },
        {
          "id": "plataformas",
          "day": "Dia 2-3",
          "title": "Imersão nas Plataformas",
          "description": "Visão das ferramentas, estrutura do CRM e pipelines operacionais.",
          "defaultDone": false
        },
        {
          "id": "playbook",
          "day": "Semana 1",
          "title": "Playbook de Vendas & SDR",
          "description": "Estudo de discursos de vendas, simulação e qualificação prática.",
          "defaultDone": false
        }
      ]
    }
  ]
}
